{
  "@context": "https://obligationfirst.org/v1/context.jsonld",
  "@type": "of:Authority",
  "@id": "https://obligationfirst.org/v1/examples/colorado-sb24-205/authority/general-assembly",
  "organization": {
    "@type": "gist:GovernmentOrganization",
    "name": "Colorado General Assembly"
  },
  "authority_basis": {
    "kind": "statutory",
    "instrument_ref": "https://obligationfirst.org/v1/examples/colorado-sb24-205/instrument/co-constitution"
  },
  "jurisdiction": {
    "@type": "gist:Jurisdiction",
    "ref": "us-co"
  }
}
